{
  "schema_version": "1.0",
  "device_id": "demo-device-001",
  "firmware_version": "f78e172-dev",
  "boot_id": "boot-demo-0001",
  "sequence": 42,
  "uptime_ms": 123456,
  "source_mode": "simulation",
  "channels": {
    "temperature_c": {
      "value": 31.25,
      "quality": "valid"
    },
    "bilge_level": {
      "value": null,
      "quality": "missing"
    },
    "vibration_index": {
      "value": null,
      "quality": "invalid"
    },
    "battery_voltage": {
      "value": 12.4,
      "quality": "stale"
    },
    "zero_test": {
      "value": 0,
      "quality": "valid"
    }
  }
}
