{
  "schema_version": "1.0",
  "device_id": "synthetic-device-physical-label",
  "firmware_version": "f78e172-dev",
  "boot_id": "synthetic-boot-0001",
  "sequence": 1,
  "uptime_ms": 1000,
  "source_mode": "physical",
  "channels": {
    "temperature_c": {
      "value": null,
      "quality": "unknown"
    }
  }
}
